{
  "schema": "map-maker.world-wonders",
  "version": 2,
  "wonders": [
    {
      "age_myr": 20.0,
      "end": null,
      "id": "wonder-eye",
      "kind": "crater",
      "name": "The Eye",
      "options": {},
      "position": [
        213.95889687654196,
        90.17516091026422
      ],
      "seed": 202,
      "size_km": 220.0
    },
    {
      "age_myr": null,
      "end": [
        137.83060930046054,
        85.27812676935882
      ],
      "id": "wonder-rift",
      "kind": "chasm",
      "name": "The Rift",
      "options": {
        "depth_m": 2500.0,
        "side_canyons": 5.0
      },
      "position": [
        145.6542231252707,
        86.44078414236473
      ],
      "seed": 303,
      "size_km": 50.0
    },
    {
      "age_myr": null,
      "end": null,
      "id": "wonder-skyfather",
      "kind": "titan",
      "name": "Skyfather",
      "options": {},
      "position": [
        131.82111260051323,
        84.11306986756253
      ],
      "seed": 101,
      "size_km": null
    },
    {
      "age_myr": null,
      "end": null,
      "id": "wonder-table",
      "kind": "tepui",
      "name": "High Table",
      "options": {
        "elongation": 1.6,
        "orientation_deg": 40.0
      },
      "position": [
        128.4871084003084,
        88.66064017950572
      ],
      "seed": 404,
      "size_km": 90.0
    }
  ],
  "world": {
    "assignments": [
      {
        "continent_id": "continent-5b504b7489544a65a3d5",
        "feature_id": "east-main",
        "role": "mainland"
      },
      {
        "continent_id": null,
        "feature_id": "scale-bar",
        "role": "exclude"
      },
      {
        "continent_id": "continent-f105099cd894607f931a",
        "feature_id": "seam-island",
        "role": "island"
      },
      {
        "continent_id": "continent-ca8b0d1db687f048e56d",
        "feature_id": "south-island",
        "role": "island"
      },
      {
        "continent_id": "continent-ca8b0d1db687f048e56d",
        "feature_id": "south-main",
        "role": "mainland"
      },
      {
        "continent_id": "continent-992d020104e84fe8a152",
        "feature_id": "west-island",
        "role": "island"
      },
      {
        "continent_id": "continent-992d020104e84fe8a152",
        "feature_id": "west-main",
        "role": "mainland"
      }
    ],
    "continents": [
      {
        "id": "continent-5b504b7489544a65a3d5",
        "name": "Eastreach"
      },
      {
        "id": "continent-992d020104e84fe8a152",
        "name": "Westreach"
      },
      {
        "id": "continent-ca8b0d1db687f048e56d",
        "name": "Southmere"
      },
      {
        "id": "continent-f105099cd894607f931a",
        "name": "Seam Isles"
      }
    ],
    "frame": {
      "bounds": [
        10.0,
        10.0,
        370.0,
        190.0
      ],
      "central_meridian_deg": 0.0,
      "projection": "plate-carree",
      "radius_km": 6500.0
    },
    "importer": "retained-svg-v2",
    "name": "Four Shores",
    "preparation": "bounded-world-v1",
    "schema": "map-maker.world-project",
    "source": {
      "name": "coastlines.svg",
      "sha256": "4e4ba5a7983988cc19d3b61b02c3c06ae47ad5e72fea1fdf4710c206167aabc2",
      "svg": "<svg xmlns=\"http://www.w3.org/2000/svg\" xmlns:serif=\"http://www.serif.com/\" width=\"1520\" height=\"840\" viewBox=\"0 0 380 210\">\n  <g id=\"Map-Furniture\"><rect id=\"scale-bar\" x=\"25\" y=\"201\" width=\"50\" height=\"2\"/></g>\n  <g id=\"Westreach\"><g id=\"Land-Shapes-West\" serif:id=\"Land Shapes\">\n    <path id=\"west-main\" fill-rule=\"evenodd\" d=\"M 38 55 C 50 30 92 35 105 45 L 134 42 L 153 63 L 180 75 L 180 105 L 160 117 L 144 110 L 115 126 L 96 106 L 73 110 L 67 92 L 42 88 Z M 87 69 L 87 81 L 102 81 L 102 69 Z\"/>\n    <g id=\"islands\"><path id=\"west-island\" d=\"M 28 95 L 35 97 L 32 105 L 24 101 Z\"/></g>\n  </g></g>\n  <g id=\"Eastreach\"><g id=\"Land-Shapes-East\" serif:id=\"Land Shapes\">\n    <path id=\"east-main\" d=\"M 180 75 L 192 60 L 215 65 L 224 51 C 244 45 262 56 260 68 L 276 78 L 264 91 L 240 95 L 235 113 L 213 123 L 197 110 L 180 105 Z\"/>\n  </g></g>\n  <g id=\"Southmere\"><g id=\"Land-Shapes-South\" serif:id=\"Land Shapes\">\n    <path id=\"south-main\" d=\"M 222 151 C 219 137 234 129 248 136 L 270 132 L 292 154 L 281 174 L 254 177 L 239 165 Z\"/>\n    <g id=\"south-islands\" serif:id=\"islands\"><path id=\"south-island\" d=\"M 308 147 L 316 151 L 314 160 L 305 158 Z\"/></g>\n  </g></g>\n  <g id=\"Seam Isles\"><g id=\"seam-islands\" serif:id=\"Land Shapes\">\n    <path id=\"seam-island\" d=\"M 365 101 L 369 95 L 375 101 L 373 110 L 366 109 Z\"/>\n  </g></g>\n</svg>\n"
    },
    "version": 1
  },
  "world_sha256": "e8574ef7c494cd1b9b20c4624d5b1e4108a0ee1ff78255a46295298258035d53"
}
